{
  "schema_version": 1,
  "identity": {"publisher": "vonk", "slug": "glm-5-2-triple"},
  "metadata": {
    "title": "GLM 5.2 on three GPU nodes",
    "description": "A three-node tensor-parallel OpenAI-compatible runtime.",
    "tags": ["text", "glm", "multinode"]
  },
  "workload": {"family": "glm-5.2", "capabilities": ["openai.chat"]},
  "build": {
    "context": {
      "sha256": "bbbbbbbbbbbbbbbbbbbbbbbbbbbbbbbbbbbbbbbbbbbbbbbbbbbbbbbbbbbbbbbb",
      "expected_bytes": 4096,
      "media_type": "application/vnd.vonk.source-bundle.v1+tar"
    },
    "dockerfile": "Dockerfile",
    "platform": "linux/arm64",
    "arguments": [],
    "network": {"mode": "public", "hosts": ["github.com", "pypi.org"]},
    "resources": {
      "download_bytes": 2000000000,
      "temporary_bytes": 18000000000,
      "memory_bytes": 12000000000,
      "timeout_seconds": 5400
    }
  },
  "parameters": [],
  "artifacts": [
    {
      "id": "weights",
      "kind": "huggingface.snapshot",
      "repository": "zai-org/GLM-5.2",
      "revision": "fedcba9876543210fedcba9876543210fedcba98",
      "download_bytes": 270000000000,
      "installed_bytes": 270000000000,
      "mount": {"target": "/models", "read_only": true},
      "roles": ["entrypoint", "worker"]
    }
  ],
  "runtime": {
    "interface": "vonk.runtime.v1",
    "adapter": "vllm",
    "adapter_version": 1,
    "entrypoint": ["vllm", "serve", "/models"],
    "arguments": [{"name": "tensor-parallel-size", "value": 3}],
    "environment": [],
    "endpoint": {
      "protocol": "openai",
      "port": 8000,
      "model_aliases": ["glm-5.2"],
      "health_path": "/v1/models"
    },
    "security": {
      "devices": ["nvidia.com/gpu=all"],
      "capabilities": [],
      "host_network": false,
      "privileged": false,
      "user": "10001:10001",
      "mounts": [
        {"source": "model", "target": "/models", "read_only": true},
        {"source": "state", "target": "/state", "read_only": false}
      ]
    },
    "lifecycle": {"pre_start": [], "post_stop": [], "stop_timeout_seconds": 30}
  },
  "deployment_profiles": [
    {
      "name": "triple-tp3",
      "description": "Three GPU nodes with tensor parallelism three.",
      "node_count": 3,
      "strategy": "tensor_parallel",
      "parallelism": {"tensor": 3, "pipeline": 1, "data": 1, "backend": "native"},
      "roles": [
        {
          "name": "entrypoint",
          "count": 1,
          "endpoint_owner": true,
          "artifacts": ["weights"],
          "resources": {
            "disk": {
              "image_bytes": 6000000000,
              "artifact_bytes": 90000000000,
              "staging_bytes": 12000000000,
              "cache_bytes": 3000000000,
              "rollback_bytes": 0,
              "safety_margin_bytes": 10000000000
            },
            "memory": {
              "kind": "unified",
              "startup_peak_bytes": 108000000000,
              "steady_state_bytes": 96000000000,
              "runtime_growth_bytes": 12000000000,
              "system_reserve_bytes": 8000000000
            }
          }
        },
        {
          "name": "worker",
          "count": 2,
          "endpoint_owner": false,
          "artifacts": ["weights"],
          "resources": {
            "disk": {
              "image_bytes": 6000000000,
              "artifact_bytes": 90000000000,
              "staging_bytes": 12000000000,
              "cache_bytes": 3000000000,
              "rollback_bytes": 0,
              "safety_margin_bytes": 10000000000
            },
            "memory": {
              "kind": "unified",
              "startup_peak_bytes": 108000000000,
              "steady_state_bytes": 96000000000,
              "runtime_growth_bytes": 12000000000,
              "system_reserve_bytes": 8000000000
            }
          }
        }
      ],
      "fabric": {"connectivity": "full_mesh", "minimum_bandwidth_mbps": 10000},
      "parameter_overrides": {},
      "measurement": "measured"
    }
  ],
  "validation": {
    "checks": ["container.started", "endpoint.healthy", "inference.completed"],
    "benchmarks": []
  },
  "provenance": {
    "source_kind": "workload_run",
    "source_reference": "workload_run:glm-5.2-triple",
    "attribution": ["Imported from a WorkloadRun profile"]
  }
}
